[
  {
    "jobId": "4454553315",
    "title": "Product Designer, Global",
    "companyId": "2135371",
    "companyName": "Stripe",
    "companyUrl": "https://www.linkedin.com/company/stripe",
    "location": "Dublin, County Dublin, Ireland",
    "jobUrl": "https://www.linkedin.com/jobs/view/4454553315",
    "postedAt": "2026-08-25",
    "jobTitle": "Product Designer, Global",
    "eventType": "new",
    "detectedAt": "2026-09-25T08:02:47.667Z",
    "firstSeenAt": "2026-09-25T08:02:47.667Z",
    "lastSeenAt": "2026-09-25T08:02:47.667Z",
    "changedFields": [],
    "source": "linkedin_public_jobs",
    "verificationStatus": "not_requested",
    "officialApplyUrl": null,
    "applyMethod": null,
    "jobStatus": null,
    "safeToPublish": null,
    "reviewRequired": null,
    "verificationConfidence": null,
    "sourceProvider": null,
    "companyWebsite": null,
    "verifiedAt": null,
    "verificationEvidence": [],
    "ghostJobRisk": "unknown"
  },
  {
    "jobId": "4454550331",
    "title": "Commercial Counsel, EMEA",
    "companyId": "2135371",
    "companyName": "Stripe",
    "companyUrl": "https://www.linkedin.com/company/stripe",
    "location": "Paris, \u00cele-de-France, France",
    "jobUrl": "https://www.linkedin.com/jobs/view/4454550331",
    "postedAt": "2026-09-07",
    "jobTitle": "Commercial Counsel, EMEA",
    "eventType": "new",
    "detectedAt": "2026-09-25T08:02:47.667Z",
    "firstSeenAt": "2026-09-25T08:02:47.667Z",
    "lastSeenAt": "2026-09-25T08:02:47.667Z",
    "changedFields": [],
    "source": "linkedin_public_jobs",
    "verificationStatus": "not_requested",
    "officialApplyUrl": null,
    "applyMethod": null,
    "jobStatus": null,
    "safeToPublish": null,
    "reviewRequired": null,
    "verificationConfidence": null,
    "sourceProvider": null,
    "companyWebsite": null,
    "verifiedAt": null,
    "verificationEvidence": [],
    "ghostJobRisk": "unknown"
  },
  {
    "jobId": "4470947859",
    "title": "Product Designer, Design Systems",
    "companyId": "2135371",
    "companyName": "Stripe",
    "companyUrl": "https://www.linkedin.com/company/stripe",
    "location": "Barcelona, Catalonia, Spain",
    "jobUrl": "https://www.linkedin.com/jobs/view/4470947859",
    "postedAt": "2026-09-23",
    "jobTitle": "Product Designer, Design Systems",
    "eventType": "new",
    "detectedAt": "2026-09-25T08:02:47.667Z",
    "firstSeenAt": "2026-09-25T08:02:47.667Z",
    "lastSeenAt": "2026-09-25T08:02:47.667Z",
    "changedFields": [],
    "source": "linkedin_public_jobs",
    "verificationStatus": "not_requested",
    "officialApplyUrl": null,
    "applyMethod": null,
    "jobStatus": null,
    "safeToPublish": null,
    "reviewRequired": null,
    "verificationConfidence": null,
    "sourceProvider": null,
    "companyWebsite": null,
    "verifiedAt": null,
    "verificationEvidence": [],
    "ghostJobRisk": "unknown"
  }
]
