{
  "jobId": "redacted-replay-job-9001",
  "title": "Backend Engineer",
  "companyId": "redacted-replay-company-12345",
  "companyName": "Example Systems",
  "companyUrl": "https://example.com/redacted/linkedin-company/example-systems",
  "location": "Munich, Germany",
  "jobUrl": "https://example.com/redacted/linkedin-job/replay-9001",
  "postedAt": "2026-07-20",
  "jobTitle": "Backend Engineer",
  "eventType": "closed",
  "detectedAt": "2026-07-29T10:00:00.000Z",
  "firstSeenAt": "2026-07-26T10:00:00.000Z",
  "lastSeenAt": "2026-07-27T10:00:00.000Z",
  "changedFields": [],
  "source": "linkedin_public_jobs",
  "verificationStatus": "not_applicable",
  "officialApplyUrl": null,
  "applyMethod": null,
  "jobStatus": null,
  "safeToPublish": null,
  "reviewRequired": null,
  "verificationConfidence": null,
  "sourceProvider": null,
  "companyWebsite": null,
  "verifiedAt": null,
  "verificationEvidence": [],
  "ghostJobRisk": "unknown"
}
