[
  {
    "jobId": "4431576226",
    "title": "Senior Software Engineer, Enterprise Products",
    "companyId": "1418841",
    "companyName": "GitHub",
    "companyUrl": "https://www.linkedin.com/company/github",
    "location": "United States",
    "jobUrl": "https://www.linkedin.com/jobs/view/4431576226",
    "postedAt": "2026-09-03",
    "jobTitle": "Senior Software Engineer, Enterprise Products",
    "eventType": "new",
    "detectedAt": "2026-09-25T08:00:44.609Z",
    "firstSeenAt": "2026-09-25T08:00:44.609Z",
    "lastSeenAt": "2026-09-25T08:00:44.609Z",
    "changedFields": [],
    "source": "linkedin_public_jobs",
    "verificationStatus": "not_requested",
    "officialApplyUrl": null,
    "applyMethod": null,
    "jobStatus": null,
    "safeToPublish": null,
    "reviewRequired": null,
    "verificationConfidence": null,
    "sourceProvider": null,
    "companyWebsite": null,
    "verifiedAt": null,
    "verificationEvidence": [],
    "ghostJobRisk": "unknown"
  },
  {
    "jobId": "4456062479",
    "title": "Senior Software Engineer",
    "companyId": "1418841",
    "companyName": "GitHub",
    "companyUrl": "https://www.linkedin.com/company/github",
    "location": "United States",
    "jobUrl": "https://www.linkedin.com/jobs/view/4456062479",
    "postedAt": "2026-09-11",
    "jobTitle": "Senior Software Engineer",
    "eventType": "new",
    "detectedAt": "2026-09-25T08:00:44.609Z",
    "firstSeenAt": "2026-09-25T08:00:44.609Z",
    "lastSeenAt": "2026-09-25T08:00:44.609Z",
    "changedFields": [],
    "source": "linkedin_public_jobs",
    "verificationStatus": "not_requested",
    "officialApplyUrl": null,
    "applyMethod": null,
    "jobStatus": null,
    "safeToPublish": null,
    "reviewRequired": null,
    "verificationConfidence": null,
    "sourceProvider": null,
    "companyWebsite": null,
    "verifiedAt": null,
    "verificationEvidence": [],
    "ghostJobRisk": "unknown"
  },
  {
    "jobId": "4457493929",
    "title": "Staff Technical Program Manager",
    "companyId": "1418841",
    "companyName": "GitHub",
    "companyUrl": "https://www.linkedin.com/company/github",
    "location": "United States",
    "jobUrl": "https://www.linkedin.com/jobs/view/4457493929",
    "postedAt": "2026-09-16",
    "jobTitle": "Staff Technical Program Manager",
    "eventType": "new",
    "detectedAt": "2026-09-25T08:00:44.609Z",
    "firstSeenAt": "2026-09-25T08:00:44.609Z",
    "lastSeenAt": "2026-09-25T08:00:44.609Z",
    "changedFields": [],
    "source": "linkedin_public_jobs",
    "verificationStatus": "not_requested",
    "officialApplyUrl": null,
    "applyMethod": null,
    "jobStatus": null,
    "safeToPublish": null,
    "reviewRequired": null,
    "verificationConfidence": null,
    "sourceProvider": null,
    "companyWebsite": null,
    "verifiedAt": null,
    "verificationEvidence": [],
    "ghostJobRisk": "unknown"
  }
]
