{
  "jobId": "redacted-live-job-01",
  "title": "Senior Director, Product Management, Slackforce",
  "companyId": "1612748",
  "companyName": "Slack",
  "companyUrl": "https://www.linkedin.com/company/tiny-spec-inc",
  "location": "San Francisco, CA",
  "jobUrl": "https://example.com/redacted/linkedin-job/live-01",
  "postedAt": "2026-07-09",
  "jobTitle": "Senior Director, Product Management, Slackforce",
  "eventType": "new",
  "detectedAt": "2026-07-28T15:00:48.497Z",
  "firstSeenAt": "2026-07-28T15:00:48.497Z",
  "lastSeenAt": "2026-07-28T15:00:48.497Z",
  "changedFields": [],
  "source": "linkedin_public_jobs",
  "verificationStatus": "completed",
  "officialApplyUrl": "https://example.com/redacted/official-apply/live-01",
  "applyMethod": "OFFSITE",
  "jobStatus": "ACTIVE",
  "safeToPublish": true,
  "reviewRequired": false,
  "verificationConfidence": 0.9667,
  "sourceProvider": "workday",
  "companyWebsite": "https://slack.com/",
  "verifiedAt": "2026-07-28T15:00:53.832740+00:00",
  "verificationEvidence": [
    "linkedin_about_website_direct",
    "linkedin_description_loaded",
    "linkedin_apply_method:OFFSITE",
    "verified_company_website_map",
    "ats_link_on_career_page",
    "official_site_to_career_source_verified",
    "generic_board_resolved_to_exact_job",
    "workday_cxs_api:query=senior director product management slackforce",
    "inventory_jobs:1",
    "best_official_title:Senior Director, Product Management, Slackforce",
    "conservative_official_inventory_match"
  ],
  "ghostJobRisk": "low"
}
